<?xml version="1.0" encoding="UTF-8" ?>
<!DOCTYPE Library SYSTEM "C:\Users\pas20\IdeaProjects\LabaWeb3.1\src\XML\Book.dtd">
    <Library>
        <bookcase number = "0">
            <book name = "Memoirs of a Geisha">
                <bookprice price ="500"/>
                <pages quantity = "350"/>
            </book>
            <book name= "Sherlock Holmes">
                <bookprice price = "625"/>
                <pages quantity = "1150"/>
            </book>
                <book name= "The Running Man">
                <bookprice price = "555"/>
                <pages quantity = "237"/>
            </book>
        </bookcase>
    </Library>
